{
  "schema_version": 2,
  "minimum_families": 30,
  "mandatory_oracles": [
    "runtime",
    "side_effect",
    "workspace",
    "verification",
    "persistence",
    "host",
    "security",
    "resource",
    "task_quality"
  ],
  "scenarios": [
    {
      "id": "runtime-turn-lifecycle",
      "title": "Turn lifecycle reaches one durable terminal",
      "family": "turn-lifecycle",
      "risk": "P0",
      "owner": "runtime-agent",
      "required_oracles": [
        "runtime"
      ],
      "impact_tags": [
        "runtime"
      ],
      "fixture_id": "runtime-turn-lifecycle-fixture-v2",
      "fixture_profile": "terminal",
      "expected_facts": [
        "turn-lifecycle-proved"
      ],
      "required_mutations": [
        "duplicate",
        "truncate"
      ]
    },
    {
      "id": "runtime-terminal-cardinality",
      "title": "Turn emits exactly one terminal",
      "family": "terminal-cardinality",
      "risk": "P0",
      "owner": "runtime-agent",
      "required_oracles": [
        "persistence",
        "runtime"
      ],
      "impact_tags": [
        "runtime",
        "persistence"
      ],
      "fixture_id": "runtime-terminal-cardinality-fixture-v2",
      "fixture_profile": "terminal",
      "expected_facts": [
        "terminal-cardinality-proved"
      ],
      "required_mutations": [
        "duplicate",
        "truncate"
      ]
    },
    {
      "id": "runtime-control-race",
      "title": "Cancel and completion race remains monotonic",
      "family": "control-race",
      "risk": "P0",
      "owner": "runtime-agent",
      "required_oracles": [
        "runtime"
      ],
      "impact_tags": [
        "runtime",
        "interaction"
      ],
      "fixture_id": "runtime-control-race-fixture-v2",
      "fixture_profile": "terminal",
      "expected_facts": [
        "control-race-proved"
      ],
      "required_mutations": [
        "duplicate",
        "truncate"
      ]
    },
    {
      "id": "runtime-mailbox-pressure",
      "title": "Cross-Turn mailbox remains bounded",
      "family": "mailbox-pressure",
      "risk": "P0",
      "owner": "runtime-agent",
      "required_oracles": [
        "resource",
        "runtime"
      ],
      "impact_tags": [
        "runtime",
        "resource"
      ],
      "fixture_id": "runtime-mailbox-pressure-fixture-v2",
      "fixture_profile": "terminal",
      "expected_facts": [
        "mailbox-pressure-proved"
      ],
      "required_mutations": [
        "duplicate",
        "truncate"
      ]
    },
    {
      "id": "provider-stream-order",
      "title": "Provider sequence normalization remains monotonic",
      "family": "provider-stream-order",
      "risk": "P0",
      "owner": "adapter-provider",
      "required_oracles": [
        "runtime"
      ],
      "impact_tags": [
        "provider",
        "runtime"
      ],
      "fixture_id": "provider-stream-order-fixture-v2",
      "fixture_profile": "terminal",
      "expected_facts": [
        "provider-stream-order-proved"
      ],
      "required_mutations": [
        "delay",
        "duplicate",
        "interrupt",
        "malformed_event",
        "split",
        "truncate",
        "unknown_event"
      ]
    },
    {
      "id": "provider-interruption-recovery",
      "title": "Interrupted provider stream recovers without duplicate effects",
      "family": "provider-interruption",
      "risk": "P0",
      "owner": "adapter-provider",
      "required_oracles": [
        "persistence",
        "runtime"
      ],
      "impact_tags": [
        "provider",
        "persistence"
      ],
      "fixture_id": "provider-interruption-recovery-fixture-v2",
      "fixture_profile": "terminal",
      "expected_facts": [
        "provider-interruption-proved"
      ],
      "required_mutations": [
        "delay",
        "interrupt",
        "malformed_event",
        "split",
        "unknown_event"
      ]
    },
    {
      "id": "tool-consequential-once",
      "title": "Consequential Tool effect executes at most once",
      "family": "tool-effect-once",
      "risk": "P0",
      "owner": "adapter-tool",
      "required_oracles": [
        "runtime",
        "security",
        "side_effect"
      ],
      "impact_tags": [
        "tool",
        "security"
      ],
      "fixture_id": "tool-consequential-once-fixture-v2",
      "fixture_profile": "security",
      "expected_facts": [
        "tool-effect-once-proved"
      ],
      "required_mutations": []
    },
    {
      "id": "tool-approval-binding",
      "title": "Approval remains bound to the exact Tool effect",
      "family": "approval-binding",
      "risk": "P0",
      "owner": "adapter-tool",
      "required_oracles": [
        "runtime",
        "security",
        "side_effect"
      ],
      "impact_tags": [
        "tool",
        "interaction",
        "security"
      ],
      "fixture_id": "tool-approval-binding-fixture-v2",
      "fixture_profile": "security",
      "expected_facts": [
        "approval-binding-proved"
      ],
      "required_mutations": []
    },
    {
      "id": "workspace-dirty-preservation",
      "title": "Pre-existing dirty changes remain intact",
      "family": "workspace-dirty",
      "risk": "P0",
      "owner": "adapter-tool",
      "required_oracles": [
        "runtime",
        "side_effect",
        "task_quality",
        "workspace"
      ],
      "impact_tags": [
        "workspace",
        "tool"
      ],
      "fixture_id": "workspace-dirty-preservation-fixture-v2",
      "fixture_profile": "terminal",
      "expected_facts": [
        "workspace-dirty-proved"
      ],
      "required_mutations": []
    },
    {
      "id": "persistence-replay-rebuild",
      "title": "Replay rebuild matches durable state",
      "family": "replay-rebuild",
      "risk": "P0",
      "owner": "persistence",
      "required_oracles": [
        "persistence",
        "runtime"
      ],
      "impact_tags": [
        "persistence",
        "runtime"
      ],
      "fixture_id": "persistence-replay-rebuild-fixture-v2",
      "fixture_profile": "terminal",
      "expected_facts": [
        "replay-rebuild-proved"
      ],
      "required_mutations": [
        "duplicate",
        "truncate"
      ]
    },
    {
      "id": "persistence-terminal-outbox",
      "title": "Terminal Outbox publishes once",
      "family": "terminal-outbox",
      "risk": "P0",
      "owner": "persistence",
      "required_oracles": [
        "persistence",
        "runtime"
      ],
      "impact_tags": [
        "persistence"
      ],
      "fixture_id": "persistence-terminal-outbox-fixture-v2",
      "fixture_profile": "persistence",
      "expected_facts": [
        "terminal-outbox-proved"
      ],
      "required_mutations": []
    },
    {
      "id": "security-guard",
      "title": "Consequential Tools cannot bypass Guard",
      "family": "guard-enforcement",
      "risk": "P0",
      "owner": "security",
      "required_oracles": [
        "runtime",
        "security",
        "side_effect"
      ],
      "impact_tags": [
        "security",
        "tool"
      ],
      "fixture_id": "security-guard-fixture-v2",
      "fixture_profile": "security",
      "expected_facts": [
        "guard-enforcement-proved"
      ],
      "required_mutations": []
    },
    {
      "id": "security-sandbox-failclosed",
      "title": "Required sandbox failure is fail-closed",
      "family": "sandbox-failclosed",
      "risk": "P0",
      "owner": "security",
      "required_oracles": [
        "runtime",
        "security"
      ],
      "impact_tags": [
        "security",
        "platform"
      ],
      "fixture_id": "security-sandbox-failclosed-fixture-v2",
      "fixture_profile": "security",
      "expected_facts": [
        "sandbox-failclosed-proved"
      ],
      "required_mutations": []
    },
    {
      "id": "security-secret-egress",
      "title": "Secrets and unauthorized egress remain blocked",
      "family": "secret-egress",
      "risk": "P0",
      "owner": "security",
      "required_oracles": [
        "runtime",
        "security"
      ],
      "impact_tags": [
        "security",
        "provider"
      ],
      "fixture_id": "security-secret-egress-fixture-v2",
      "fixture_profile": "security",
      "expected_facts": [
        "secret-egress-proved"
      ],
      "required_mutations": [
        "delay",
        "interrupt",
        "malformed_event",
        "split",
        "unknown_event"
      ]
    },
    {
      "id": "host-projection",
      "title": "Host projection matches Runtime terminal state",
      "family": "host-projection",
      "risk": "P0",
      "owner": "host",
      "required_oracles": [
        "host",
        "runtime"
      ],
      "impact_tags": [
        "host",
        "runtime"
      ],
      "fixture_id": "host-projection-fixture-v2",
      "fixture_profile": "terminal",
      "expected_facts": [
        "host-projection-proved"
      ],
      "required_mutations": [
        "duplicate",
        "truncate"
      ]
    },
    {
      "id": "host-reconnect",
      "title": "Host reconnect has no duplicate or missing item",
      "family": "host-reconnect",
      "risk": "P0",
      "owner": "host",
      "required_oracles": [
        "host",
        "persistence",
        "runtime"
      ],
      "impact_tags": [
        "host",
        "persistence"
      ],
      "fixture_id": "host-reconnect-fixture-v2",
      "fixture_profile": "host",
      "expected_facts": [
        "host-reconnect-proved"
      ],
      "required_mutations": [
        "duplicate"
      ]
    },
    {
      "id": "orchestration-subagent-effect",
      "title": "Subagent effects remain isolated and at-most-once",
      "family": "subagent-effect",
      "risk": "P0",
      "owner": "orchestration",
      "required_oracles": [
        "runtime",
        "side_effect"
      ],
      "impact_tags": [
        "orchestration",
        "tool"
      ],